restaurant,review,rating,date
360 The Restaurant at the CN Tower,The service is nice but the food us terrible and what prices for such a avarage food! 😵‍💫<br>I recommande you go and visit the tower and avoid the restaurant especially if you are second or third row because you can’t see a lot.,2,09/08/2025
360 The Restaurant at the CN Tower,"You're basically paying for the ride up the elevator because the food was awful. So dry. It was bad relative to the pricing. Also if you are a large party, they tack on 20% gratuity whether they deserve it or not and they definitely didn't earn that tip. The view was nice but that's about it.",1,09/08/2025
360 The Restaurant at the CN Tower,"I’ve been coming to this restaurant for years for special occasions or family visiting Toronto.<br>Last Friday, we had dine to the usual 3 course meal.<br>I noticed that the services and cleanliness has declined with the “new faces” of service staff.<br><br>I pointed out to our server (I think his name is Clarence) that we received dirty cutlery with food residue, wine glass with lipstick and slower service than usual. We have to literally ask for water, bread, after 20 minutes of sitting. Also, when the server brought our food out, they are not careful putting down plates and cutlery on the table(bang on table) which is not a good manner in serving guests dining.<br><br>I hope the floor manager or person in charge to address this issue.",2,09/08/2025
360 The Restaurant at the CN Tower,"OMG Amazing experience! Stunning city views, delicious food, and excellent service😍😍😍",5,09/08/2025
360 The Restaurant at the CN Tower,impressive view with good food，easy booking online，20%tips is a bit higher,5,09/08/2025
360 The Restaurant at the CN Tower,This is one of those restaurants that you only go there once for the experience. The food is okay - not bad and not great.<br>The service is a bit worst than okay - no extra and very cold.<br><br>The view however is absolutely stunning - and the restaurant turns 360 every 60 min (based on my calculations).,3,09/08/2025
360 The Restaurant at the CN Tower,"I celebrated my birthday at 360 Restaurant at the CN Tower, and it was an experience to remember. I made a reservation ahead of time, and from the moment we arrived, everything felt seamless. The three-course menu I chose was $90, and each dish was a delight. For starters, I had the Grilled Calamari, it was light, perfectly seasoned, and set the tone for what was to come.<br><br>For the main course, I went with the Sundried Tomato and Caper Spaghetti, a vegan option. The grilled artichokes, baby bell peppers, and herb gremolata paired beautifully with the basil olive oil and the subtle touch of Verona pecorino. It was flavorful and filling.<br>To finish, I indulged in the Ontario Strawberry and Pistachio Layer Cake (gluten-free), just the right balance of flavors, it was the perfect finale. What made the evening even more special was the 360-degree rotating view of the city. Watching the city while enjoying the dishes added an unforgettable touch. Everything about the experience felt elevated literally. The three-course menu for two, along with drinks, came to just over $300, worth every penny for the food, the service, and the views. If you’re looking for a place to celebrate a special occasion with delicious food and a view that takes your breath away, 360 Restaurant is a spot worth experiencing.",4,09/07/2025
360 The Restaurant at the CN Tower,The waiter was rude<br>Mid food and dirty glasses<br>But amazing views,2,09/07/2025
360 The Restaurant at the CN Tower,"Food is pricey, but also terrible. Calamari as an appetizer was flavourless, all vegetables with my  cod were extraordinary undercooked, as was my wife’a entire vegan meal.<br><br>The servers do not check in during the meal to see if anything can be adjusted (I.e. subbing a salad or fries instead of rock hard potatoes).",1,09/06/2025
360 The Restaurant at the CN Tower,Ceaser salad came to table started to eat<br>Roman leaves were frozen.?,5,09/05/2025
360 The Restaurant at the CN Tower,"Fun concept, nice menu and exceptional service. Small portions so good to try multiple items on the menu. The only downside was how packed the elevator going up was - did not have space to move. Too close to strangers.",4,09/05/2025
360 The Restaurant at the CN Tower,"I’ve always loved 360 Restaurant at the CN Tower and this was my 5th visit. In the past I’ve had nothing but wonderful experiences — I often bring my out-of-town family and friends here and rave about it. I’m also very easy-going, I don’t fuss if an order is wrong and usually just enjoy the experience.<br><br>This last visit, however, was really disappointing. It took almost 50 minutes to reach someone by phone to adjust our reservation after a doctor’s appointment ran late. When we arrived, the restaurant was almost empty with heaps of available tables, yet we were walked to one that hadn’t been cleaned. When we asked about sitting at another available table, we were told a very stern “no” with no explanation, and were left standing by the wall for about 10 minutes while staff passed us without a smile or a hello.<br><br>Our server was kind and friendly (thank you to him), but the overall atmosphere felt unfriendly, the food was mediocre, and shrinkflation was noticeable. The waiter forgot a few times of what we requested and had to remind him but we didn't mind that because the waiter was friendly and humble and took responsibility. At the end, we were mistakenly charged three times and had to call afterward to have it corrected.<br><br>I’ve never written a bad review before, but this visit was such a letdown compared to the warm and welcoming experiences I’ve always had here. I hope management takes this to heart because it’s not just about the view — it’s about the hospitality.",1,09/04/2025
360 The Restaurant at the CN Tower,"The food is far from fine dining. They made us wait in the hallway for 25 minutes even though we had a reservation. During the meal, the service staff were making really loud noises with dishes next to us the whole time. The view is nice, but we have the same view on the floor below. Very disappointing; for the same price, we have eaten in much better restaurants.",2,09/04/2025
360 The Restaurant at the CN Tower,Food was good but the check in was way too long. Many layers of checking your reservation for nothing through the way up the restaurant. Then tens of people after check in were sent to a squeeze corner and wait there. I told the manger I would request a high chair. Instead was given a booth seat with no place for high chair. Need to request again and wait another 15 minutes. My child was running out of patience.,3,09/03/2025
360 The Restaurant at the CN Tower,"I had high hopes of enjoying a special time here with my parents on their first visit to Toronto. I booked a table a couple of weeks in advance and specifically asked for a great view, but we were seated in the second row, not by the window. The food was just average, which was acceptable, but the service was truly disappointing.<br><br>The server showed aggressive behavior and, without even asking, brought us the bill after less than an hour—even though we had booked for a relaxed experience. This was extremely upsetting. As a Level 7 Google reviewer, I’ve never had such an experience before. I left only a 10% tip and explained the reason, since I’ve never been rushed out like that. Although the server apologized, it didn’t mean much after the fact.<br><br>The view was amazing, but unfortunately the overall experience was awful.",1,09/02/2025
360 The Restaurant at the CN Tower,"Amazing experience!! I would go again and again.. I don't know why people complain, the food and service here are amazing.. worth the experience! Thank you so much.",5,09/01/2025
360 The Restaurant at the CN Tower,Had a wonderful time. Beautiful views! Our server Vincent was fantastic! The food was delicious (try the Indigenous Menu!) Would not change a thing!,5,08/31/2025
360 The Restaurant at the CN Tower,"Although the food was not so bad, the service left us extremely dissatisfied. I had booked seats by the window in advance, but we were placed near the entrance and server stations, where it was noisy and crowded, despite many empty tables by the windows. Throughout the meal, we had to place our orders with different waiters because it was difficult to find the one assigned to our table.<br><br>The most upsetting moment happened at the end of our lunch when a waiter threw the receipt onto our table in front of our parents and baby, possibly because he was unhappy with the tip. This behavior felt very disrespectful and unacceptable, especially considering that we spent more than $400 on lunch.<br><br>This experience left the worst impression of Canada at the end of our trip. I hope this feedback will be seriously taken and ensure better service for future customers.",1,08/31/2025
360 The Restaurant at the CN Tower,"Incredible dining experience at this restaurant, I brought my in-laws from Ireland and this was their first experience in Toronto and they loved it. Sabbir was an incredible waiter and had so much knowledge about the building and the general surroundings of Toronto you are able to look at. Their seafood, presentation and service were all top notch. If you do not have much time in Toronto and you want to feel like you have seen the city, this is the fastest way to do it with gorgeous food and lovely drink options. Thanks, Sabbir!",5,08/30/2025
360 The Restaurant at the CN Tower,Ticket for the tower alone is 50. Paying 50 extra for a good meal with unbeatable view is a must-take offer for me!<br><br>Our 2-year-old enjoyed the whole meal too!<br><br>Service was a bit slow as more people are seated. It took us 20min to get checked. Our kid became too tired for nap time and got cranky.,5,08/30/2025
360 The Restaurant at the CN Tower,Really nice food and service. Jeff was superb and was even kind enough to give us a quick tour of the CN tower. Would recommend,5,08/29/2025
360 The Restaurant at the CN Tower,"This was a great way to close out a week long trip in the Toronto area. We took the  WeGo Train from Unionville to Union Station and the CN Tower was about 10 min walk away. Good thing because it was very busy on a Sunday afternoon.  For a pricier, better meal you get to sit and enjoy a great view. We did the three course meal, we had the cod, it was very good. The mussels were excellent. We had the strawberry cake and the mousse for dessert. It was well worth skipping all the ice-cream trucks on the street. If you plan to go to the restaurant, get there early before your reservation. It took us about a half hour to get through security and wait in line for the elevator to take us up. Hit the gift shop on the way out! Got three new pins. Overall, this was a great experience!",5,08/26/2025
360 The Restaurant at the CN Tower,"Loved the experience and views! Staff is very kind and professional. Food was good, but very expensive for the quality and portions.",5,08/26/2025
360 The Restaurant at the CN Tower,"It was our second visit to this restaurant. The food was good, and the service was also very nice until we paid. It was 20 percent tip already included, so we simply paid as shown. From that moment, the server stopped smiling, showed us unpleasant facial expressions, squeezed in between us, and began taking dishes away very loudly.<br>I am curious—am I supposed to tip twice?",1,08/25/2025
360 The Restaurant at the CN Tower,"Highly recommend. Lovely restaurant, great view, good service, excellent wine list. The food is good but nothing special. You go for the experience. The fixed price menu is a good deal if you also want admission to the observation deck.",4,08/25/2025
360 The Restaurant at the CN Tower,Everything was perfect<br>The food the breathtaking view and the service<br>One of the best places in toronto,5,08/25/2025
360 The Restaurant at the CN Tower,"I had such a wonderful time at the 360 Restaurant! The atmosphere was elegant yet relaxing, and the rotating view of Toronto was absolutely breathtaking every moment felt special as the skyline kept changing around me.<br><br>The food was delicious and beautifully presented, paired perfectly with the fine dining experience. The staff were warm, attentive, and made my friends and I feel truly welcomed throughout.<br><br>Between the amazing service, the unforgettable view from the CN Tower, and the overall vibe, it was an experience I’ll always remember. Definitely a must-visit for anyone looking for a unique dining experience in Toronto!",5,08/24/2025
360 The Restaurant at the CN Tower,"Great atmosphere, great view, great service. The food was horrible. We got the 3 course fix price meal.  For appetizers the Calamari was literally 3 pieces and cold. Mussels were okay.<br>For Main course. Salmon was super bland and unsalted, althouh",3,08/24/2025
360 The Restaurant at the CN Tower,"What a cool experience! Getting into the building and up the elevator was quick and easy since they have a separate line for dinner guests. We were seated at a window table which was a bonus, but we were also sat between two families with kids. Which for a couple getting dressed up and going out for a very expensive dinner wasn’t very pleasant.<br>Food was great, again though, very expensive.<br>We did enjoy having the ability to go to the observation deck after dinner.<br>Probably won’t do it again, but a nice experience to try once.",4,08/23/2025
360 The Restaurant at the CN Tower,"Extremely disappointing experience. The service was chaotic and unprofessional. Our server, Zahid, seemed disorganized and overly rushed, which made the dining experience uncomfortable. At one point, he placed our cutlery directly on the table instead of on the serviette which was RIGHT THERE! something that felt unhygienic. Communication was also a challenge, as there was a language barrier that made it hard for us to understand each other. The food itself was mediocre at best and definitely overpriced for the quality. Overall, I left very dissatisfied and will not coming back..",1,08/22/2025
360 The Restaurant at the CN Tower,"It’s not just dinner, it’s an experience of a lifetime. The staff are amazing and very efficient. Time slipped away while we were there. Always something new to see. The perfect place for a fancy date night, or a high end family experience.",5,08/21/2025
360 The Restaurant at the CN Tower,"Bobby, our server, was amazing! We were celebrating a special occasion, and he truly made our dinner special. His enthusiasm was a delight, and he was very on top of everything despite the restaurant being busy.<br><br>However, the reservation process could be improved. When booking, I explicitly specified wanting a window seat and indicated to please inform me should this not be possible. When we arrived at 5:30pm, we were told that the hostess saw the note but that all window seats went at opening at the 4:30pm seating and we could wait an hour if we wanted a window seat. This could have been avoided had I just been informed in advance to modify my reservation time to either 4:30pm or 6:30pm, but I never received any information from the restaurant despite booking a month in advance.",4,08/20/2025
360 The Restaurant at the CN Tower,"We had our Anniversary dinner at the 360 Revolving Restaurant on top of the CN Tower 2 weeks ago around 5:30pm on Wednesday.<br><br>As usual, CN Tower is always busy but with a  restaurant reservation, it included the exclusive elevator access to the top of CN Tower bypassing the long long line up (the same when you are trying to come back down, you can use the restaurant elevator after you visited the indoor and outdoor observation level, just shows your reservation ticket to go back to the restaurant to take the elevator down).<br><br>We had the 3 courses meal, the mussels is amazing comparing to the grilled calamari.<br>Both the prime ribs (medium rare) and Pork Tenderloin were delicious (we both loved the Prime Ribs more as they also added a charcoal grill on top of the prime ribs to bring up the favours) 😋😋😋<br><br>Desserts were very yummy also with the different layers of favours and so lovely they put the anniversary chocolate and candles on top of our desserts.<br><br>The service is good and all staff greeted us for our anniversary (you can indicated your special occasion when making reservation online).<br><br>I would give 5 stars for service if our waiter can have more smile. He is good but a bit cool. 😅<br>Overall, we enjoy the unbeatable views and the beautiful sunset up there.<br><br>There is a minimum spend of $75 (plus tax and gratuity) per guest on food, but since it included the elevator, and lovely views and delicious fine dining.  It is well worth it!!!<br><br>We spent a total of approx $350 (included tax and tips) for 2 of us there 🤗<br><br>This place meant a lot to us as it was our first dating place many many many years ago 🥰<br>Good job 360 & CN Tower 🙏🏻",5,08/19/2025
360 The Restaurant at the CN Tower,The food is too expensive and I don't like it....terrible l it's really bad . .good presentation but nah,2,08/19/2025
360 The Restaurant at the CN Tower,"We had such a great experience! The indigenous dishes were delicious, the staff were professional, the desserts were perfect, and the view was stunning with a really relaxing vibe. The manager was so respectful and passionate, and gave us a personal tour, which made the visit extra special.",5,08/18/2025
360 The Restaurant at the CN Tower,It’s a nice spot for a special occasion. The restaurant slowly rotates and you get a nice view.<br><br>We ordered from the prix fix menu which also includes entrance to the observation deck and glass floor.<br><br>It’s a nice spot for a a celebration.,4,08/18/2025
360 The Restaurant at the CN Tower,"I loved my experience. Everything was amazing. I'd come back 10,000 times if I could.",5,08/16/2025
360 The Restaurant at the CN Tower,I can see why they went in strike. The staff are not organized. We were told we would have time before dinner to go on the observation deck 30mins before our dinner reservation then it was 10mins before and told we could just join the line for the elevator but stopped by a different staff member and told to wait. So we didn’t get to see anything cause it was dark after dinner. They pack you in so tight in the elevator you can’t even check out the view. Got seated at a booth and told that we would have to go back down to request a window seat and wait another 45mins! There were tables by the window free so it should not have been an issue. Travelled all the way from BC. Made a reservation so we could see the sunset not people at the tables. Food was good. And the waiter we had was good but sadly would not recommend as it was disappointing to not be able to see the view and being given some lame excuse as to why when there were empty tables by the window. Dinner was about $300 so when you spend that kind of $ you should be accommodated if possible.<br>Better to go on the observation deck and have dinner somewhere else.,2,08/16/2025
360 The Restaurant at the CN Tower,"The service was spectacular, but the food quality was quite average for the price. The main draw is really the views, though the ambience doesn’t feel as premium as the price suggests. At night, the views weren’t at their best, but it was still a unique experience to slowly revolve around the city skyline. That said, it’s not the most celebratory environment, so the premium price might not be worth it when there are other great alternatives available.",3,08/15/2025
360 The Restaurant at the CN Tower,The service was quite slow and the food was inconsistent. The two plates of Chicken Supreme were overcooked and dry. The other two entres were ok and the appetizers were good. When we mentioned the chicken to the staff they offered a half hearted apology.,3,08/15/2025
360 The Restaurant at the CN Tower,"360 Restaurant offers the best city views, exceptional service, and absolutely delicious food. A perfect spot for a memorable dining experience!",5,08/14/2025
360 The Restaurant at the CN Tower,"Wanted to take my spouse for surprise dinner, and boy this one didn't disappoint at all. We loved the ambiance and atmosphere. The restaurant revolves 360 degrees giving you all possible views of the city while enjoying your favourite dishes! A special shout to the chefs and attendants who made the visit worth while.",5,08/13/2025
360 The Restaurant at the CN Tower,Grrat once you get up amd seated..They make you wait for the full group and have a painful security process to get there.<br>Once seated all is well amd views are amazing,4,08/13/2025
360 The Restaurant at the CN Tower,"It was too hot. The server stephen was rude and we had our anniversary there was no celeberations. The server made connections and had a word with everyone he was serving but was too the point with us and took the order after so long. we were seated at 8 15 pm and made us wait until 845 pm as we were waiting to order and we had some doubts. He just told us he will come back and took 30 min to come back as he was chatting with other customers and when I tip him for bad service. he made comments such as its not me, its just you. Very rude and mean. Did not like it at all. I took my parents there and was surprised and shook with the behaviour.",1,08/11/2025
360 The Restaurant at the CN Tower,"Honestly this was a great night with great views but it wouldn’t have been without the great service my our host Imran. He took time to ask of for photos and made sure to get all the angles, he helped us explore new views of the city. He was an uplifting energy when he came around to check on us. He made sure to help us celebrate our special anniversary and never failed to make us feel special. Huge shoutout to Imran, great host, great service and even better views",5,08/10/2025
360 The Restaurant at the CN Tower,"Very poor experience! It is almost impossible to cancel or modify a reservation, my wife was on the phone for over an hour trying to cancel our reservation so we wouldn't be charged $120 in cancellation fees and the urant when I asked if this wait time and service was typical the response we got was just "" sorry we are pretty busy today"" - the phone number has no estimated wait time, and there are no other online options to cancel. We have come here  in the past with various out of town guests but will no longer be recommending this restaurant.",1,08/09/2025
360 The Restaurant at the CN Tower,The number for cancellation doesn’t work! Was on hold for over an hour and will now be charged a cancellation fee. Unacceptable!,1,08/09/2025
360 The Restaurant at the CN Tower,"Great service. Good and fresh food. Of course the view is spectacular. Ricky, our waiter, noticed that the steak was over done and not medium. He immediately swapped it!",5,08/09/2025
360 The Restaurant at the CN Tower,"Spectacular evening at 360 celebrating our wedding anniversary, food, service and atmosphere top notch, highly recommended!",5,08/09/2025
360 The Restaurant at the CN Tower,"They mark a bunch of dishes as vegetarian but when we asked if the cheese used in preparing the dishes was made from animal rennet or not, they couldn't answer. And frankly speaking the passive aggressiveness by our server Maks because he didn't get the tip % he wanted, didn't help either.",1,08/08/2025
