restaurant,review,rating,date
360 The Restaurant at the CN Tower,"⭐️⭐️⭐️⭐️⭐️ A Wholesome, Once-in-a-Lifetime Experience at the CN Tower Restaurant<br><br>I don’t even know where to begin—my experience at the CN Tower restaurant was easily one of the best moments of my life. Harsh had always promised me crazy, unforgettable things, and this time he truly delivered.<br><br>From the moment we stepped into the tower, everything felt magical. The views were breathtaking—Toronto glowing beneath us as the restaurant slowly rotated, giving us a 360° panorama without ever leaving our seats. The atmosphere was warm, elegant, and absolutely perfect for a special night.<br><br>The food was outstanding, but the indefinous mushroom soup was on a whole different level. I still can’t forget the richness of that soup—the deep, earthy flavor paired with the tangy honey-pickled mushrooms was unforgettable. It was the kind of dish that stays with you long after the meal is over.<br>More than the view and the food, though, it was the feeling of being there—sharing that moment, that surprise, that promise fulfilled—that made the night truly special.<br><br>It wasn’t just dinner; it was an experience. A wholesome, heart-filling, beautifully memorable experience. If you ever get the chance to go—especially with someone who makes the moment special—don’t think twice.",5,11/15/2025
360 The Restaurant at the CN Tower,A very memorable birthday dinner！！！,5,11/13/2025
360 The Restaurant at the CN Tower,"The view from the CN Tower restaurant was truly spectacular and worth visiting for the scenery alone. However, our dining experience was unfortunately overshadowed by the attitude of one of the male servers.<br>There were three of us, and as soon as we were seated, he asked who spoke English the best. He then said he would only explain the menu to that person and told them to explain it to the others, adding that he didn’t want to repeat himself. This made us feel uncomfortable and disrespected. We understand English well, but regardless of one’s language ability, such behavior is inappropriate and unprofessional.<br>Additionally, the server forgot the beer we ordered. When we reminded him and finally received the drinks, our main dishes had already gone cold.",1,11/12/2025
360 The Restaurant at the CN Tower,Really good deal for lunch and tour. Prime Rib was very delicious. Great view of the city.,4,11/12/2025
360 The Restaurant at the CN Tower,"Feels expensive but if you consider the tickets included, makes total sense. Great view, outstanding service and great food quality. I particularly liked the chowder soup.",5,11/12/2025
360 The Restaurant at the CN Tower,"Overpriced, but you pay for the experience - which is worth it in my opinion. Service was quick and friendly, but the limited and pricey menu prevented 5 stars. I would still highly recommend coming to eat dinner here at least once though!",4,11/11/2025
360 The Restaurant at the CN Tower,"I couldn't fault this restaurant at all, the entire evening was flawless from beginning to end. Jeff's service was outstanding; he made us feel completely at home and was incredibly warm and engaging. We were celebrating our engagement, so it was a truly memorable night we wanted to cherish.<br><br>To start, the slowly rotating 360-degree views of Toronto are stunning, and the food was equally impressive. I had the mussels followed by the steak, both of which were exceptional. My fiancée loved her grilled peppers and mushroom pasta too.<br><br>Overall, it was a perfect evening with superb food, service, and great views of the city!",5,11/10/2025
360 The Restaurant at the CN Tower,"Totally worth it, while the food is a bit on the expensive side, the fact you get access to the tower  it makes a worthy investment. Food is ok, not exceptional, but we went for the views anyway",5,11/09/2025
360 The Restaurant at the CN Tower,"I came here for dinner as a tourist as I wanted to check out the revolving restaurant and try the food.<br><br>You need to spend a minimum of $75 and that's just on food (not drinks), they have al la carte for a Prix Fixe menu for $75 so we opted for that - made it a lot easier. You need to reserve a table online also however you can only to up a month in advance.<br><br>I went for the grilled calamari starter/appetizer and Fogo Island Cod main/entrée. Both were delicious, the calamari had a really nice, extra savoury taste from being pan fried and was cooked perfectly, tentacles included which I loved! The Fogo cod came with a herb crust, tomato based sauce and some new potatoes underneath. Cod itself was perfect, I was indifferent about the herb crust but didn't mind it. The tomato sauce was slightly bland and the potatoes could've been softer for my liking but overall decent.<br><br>My companion went with the Salmon Gravlax to start and Maple Chilli Chicken Supreme. She didn't care for the berries with the salmon, it was cured and she also felt it wasn't the best quality (tasted like supermarket smoked salmon slices). The maple chicken itself was well cooked, moist and the glaze/sauce used wasn't too sweet & perfectly balanced. Found the potato pavé lacking flavour and cold sadly.<br><br>A great experience overall and I enjoyed going. You also get access to the main observation deck as part of your reservation too.",4,11/08/2025
360 The Restaurant at the CN Tower,"The hype of this restaurant did not meet the expectations that you would see in reviews. Though the view is beautiful when you ask for a window seat celebrating an anniversary and then don’t get one. It’s quite disappointing to start your experience. We had a server named Mike Sg Who is less than attentive throughout the entire dinner. The bus boy gave us more attention than the server and constantly clearing and checking in on us throughout the dinner. We saw the server to place our order after he dropped off drinks. We’ve never saw him again until the check was coming.<br><br>We never were asked how our food was. We were never offered additional drinks. Had to ask another server for salt and pepper.<br><br>As previously mentioned, the hype of this restaurant was going to be a great experience and it did not meet that by any means.  For dinner that was over $400 it sure was disappointing.!!",2,11/08/2025
360 The Restaurant at the CN Tower,"Honestly if you have children and would like to bring them to the CN Tower, this is the only way to do it. The meal cost covers the tickets into the tower, and ends up being a really good value. More importantly, it allows you to spend some time and enjoy the views of the city for more than the 5 minutes it will take for the children to get bored of the observation deck. Highly recommended!",4,11/05/2025
360 The Restaurant at the CN Tower,"The view from 360 is stunning, but the service completely ruined our experience. We had a reservation at 8:30 pm and politely asked if we could move to a window table once one became available. Several tables opened, but our server ignored the request and spoke to us with a dismissive attitude. When he finally moved us, his tone became even more condescending.<br><br>By the end of the dinner, my mother was paying and decided not to leave a tip because of the poor service. The waiter actually said, “Are you not leaving a tip?” while standing over her, which was shockingly rude and unprofessional.<br><br>For a restaurant that charges a minimum of $75 per person, I expected respectful and welcoming service, not this attitude. The view is great, food is tasty, but our server made us feel uncomfortable the entire evening.",1,11/05/2025
360 The Restaurant at the CN Tower,"Good food, great espresso martinis, excellent views.",4,11/05/2025
360 The Restaurant at the CN Tower,"Wow. Such poor food standards. Steak overcooked, service very transactional, very much mediocre food. Would not visit again. View was great though! Zero wait time between courses. Don’t visit. Just do viewing deck and eat elsewhere",1,11/04/2025
360 The Restaurant at the CN Tower,Food and service was good. The rotating aspect of the restaurant is definitely a cool novelty,4,11/02/2025
360 The Restaurant at the CN Tower,Little bit on the costlier side! But service and food were good!,3,11/02/2025
360 The Restaurant at the CN Tower,"I had an absolutely terrible experience at the 360 Restaurant at the CN Tower while trying to use my gift vouchers that I had from Feast On for my boyfriend’s 40th birthday dinner.<br><br>When I showed our vouchers to the server, he had to get the manager. The manager then asked to inspect my phone and emails and made us wait about over 30 minutes while he made “phone calls” to verify them —  It was humiliating and made me feel like I was doing something wrong when I was simply trying to redeem a legitimate gift. After waiting that long, they ended up declining them, even after showing how they are on the actual feast on ontario website.<br><br>To make things worse, the food was disappointing. The prime rib was fatty and grilled like a steak, and the chicken was dry and rubbery.<br><br>What was supposed to be a special night turned into one of the most uncomfortable and embarrassing dining experiences I’ve ever had. I left in tears. I would never recommend this restaurant to anyone — especially if you’re using a voucher or celebrating a special occasion. Absolutely degrading and disappointing. I reached out to feast on and they were incredibly apologetic and disappointed for me. What is supposed to encourage you to experience new restaurants, turned into a complete discouraging awful one.",1,11/02/2025
360 The Restaurant at the CN Tower,Atmosphere is amazing but the food is decent at best and the servers all have a horrible attitude…they are rude or just ignore you constantly,2,11/02/2025
360 The Restaurant at the CN Tower,"We were there for our anniversary and had a terrific dinner. Dinner was delicious service excellent. Bobby our server, was excellent, gracious, and attentive.",5,11/01/2025
360 The Restaurant at the CN Tower,"Incredible view, good food an decent drinks, but the service not that good, from the begining the waiter was counting each price warning us about the $75 minimun per person, i wasnt asking.",3,11/01/2025
360 The Restaurant at the CN Tower,"Went for dinner in a group. This is a tourist trap higher than normal prices are expected. They try to source food locally and surprisingly the prices were reasonable- 3 courses for $100.00. However even though the food was good the portion sizes were small. Service was good, but the place is quite loud. They offer a chocolate dessert, but it is only available as a vegan option. They should offer a non-vegan version",4,10/31/2025
360 The Restaurant at the CN Tower,Great view. Better food and friendly.,5,10/31/2025
360 The Restaurant at the CN Tower,"I had a good dinner, but a fantastic view and that is what you will pay for. Beautiful views especially if you go for sunset!!<br><br>If you like seafood, specifically scallops, definitely get them, they are delicious!<br><br>An iconic “one time” experience!!",3,10/30/2025
360 The Restaurant at the CN Tower,Very friendly atmosphere  I like it very much,5,10/28/2025
360 The Restaurant at the CN Tower,Our waiter in section 9 (and his support staff) were great.  I think his name was Justin?  We brought friends from Poland who were visiting and we all thought it was an incredible experience.  I forgot as a Torontonian how great a spot it is!  Hope to visit again soon.,5,10/27/2025
360 The Restaurant at the CN Tower,"After spending $500 walked out very disappointed. The menu is absolutely horrible and needs an overhaul. for example, spending $90 on steak and if you don’t order sides, it comes on a plate with nothing on it. Servers arguing on sides. Only 2 Sharable apps. view is great but food is not.",1,10/25/2025
360 The Restaurant at the CN Tower,"We went to the 360 Restaurant at the CN Tower to celebrate my boyfriend’s birthday — a very special day that we were truly excited about. We expected a world-class experience from such a famous and expensive restaurant. But the moment our food arrived, we were shocked to see a fly sitting on top of the dish.<br><br>This completely ruined our appetite and the mood of our celebration. Although the waiter replaced the food, the damage was already done. We still paid the full bill and even left a tip out of respect, but honestly, this should never happen in a restaurant of this level.<br><br>It was embarrassing, disappointing, and offensive to experience such poor hygiene and quality control at one of Toronto’s most iconic dining spots. I truly hope management takes this seriously, because no guest should go through this — especially during a special occasion.",1,10/24/2025
360 The Restaurant at the CN Tower,"Besides the amazing view, the food was delicious , we loved the presentation. The service was great, exactly what we would expect it to be. Everything was explained very well, this is a great way to view the city and have an awesome meal.",5,10/22/2025
360 The Restaurant at the CN Tower,Food was exceptional. Ambience and experience was top class. Only the quantity of Sangria pitcher was very less. It should be atleast 4 Glass servings as per the standards of a pitcher.,5,10/22/2025
360 The Restaurant at the CN Tower,"Amazing experience, with even better  service!  Thank you Spiro.",5,10/21/2025
360 The Restaurant at the CN Tower,"The best thing about this restaurant is the amazing view and the novelty of a rotating restaurant 1000 ft in the air. Otherwise, the food was mid for the price ($75 per person) and the service provided by our hostess was lackluster. We did appreciate the busser / server assistant for helping us with our various requests.",3,10/21/2025
360 The Restaurant at the CN Tower,"Great views and an experience to have dinner<br>Unfortunately the food was not good. I had calamari to start, it was cool in temperature and wet with oil. The beef I had for main was just okay. Probably not worth visiting the restaurant and just go up for the views.",3,10/21/2025
360 The Restaurant at the CN Tower,Amazing dine in experience and I got to celebrate my bday with friend here.<br><br>Mark made it a pleasant experience for us altogether.,5,10/20/2025
360 The Restaurant at the CN Tower,we visited to celebrate a birthday and left with such wonderful memories!!<br>the steak was a bit underwhelming but the lobster and risotto were absolutely delicious!,5,10/20/2025
360 The Restaurant at the CN Tower,Very beautiful view but the staff just try to send you away asap and it was not pleasant.<br>Food was average with overcooked fish.<br>Very expensive view…,3,10/19/2025
360 The Restaurant at the CN Tower,Had dinner here on a Saturday night and sat by the windows. Ate good food but had terrible service by our waiter Hameed. Made our experience very unpleasant and not want to come back. BEWARE IF YOU GET THIS WAITER ASK FOR ANOTHER ONE!!,3,10/19/2025
360 The Restaurant at the CN Tower,"For such a tourist spot, the foods are especially creative, love that!",5,10/18/2025
360 The Restaurant at the CN Tower,Absolutely amazing time. Food and service was amazing. And the view is top notch,5,10/16/2025
360 The Restaurant at the CN Tower,"The food truly surpassed my expectations in both taste and presentation. I tried something outside my usual choices and was amazing. The service was top-notch, and the revolving view of Toronto added a unique and memorable touch to the experience. It’s an ideal place for a special celebration or for anyone exploring the city. I’d definitely recommend it!",5,10/14/2025
360 The Restaurant at the CN Tower,"What an amazing experience! Beautiful!  Took a few minutes to get used to the rotating building but other than that, it was wonderful food was delicious",5,10/13/2025
360 The Restaurant at the CN Tower,"Made my reservation at 9pm and arrived on time. However, it took an additional 35minutes to be seated. Before being seated, I walked to the hostess stand and saw 3 employees talking amongst themselves ignoring me to the point where I had to ask the hostess/manager if we were going to be seated at all.<br><br>Shortly after, they apologized and immediately found us a table. Due to this reaction, I felt that they had forgotten about my wife and I and attempted to recover by giving us a table within seconds.<br><br>Additionally, our server seemed like he was in a bad mood and did not arrive back at our table for about 20mins after the first visit. At this point, it is approximately 9:50pm and I had to ask a different server that we were ready for our order (he was polite).<br><br>Food -<br><br>risotto 1/10 way too much oil felt like you were drinking soup<br><br>Cod 1/10 bland overall flavorless<br><br>Grilled calamari 9/10 really flavourful highly recommend<br><br>Spaghetti 2/10 flavorless.<br><br>This visit was for our wedding anniversary and was overall disappointed with the experience. I am not one to usually write reviews but felt that this messaged needed to be conveyed in order to help for the next guest's experience.",1,10/13/2025
360 The Restaurant at the CN Tower,"Food is nice, service not",5,10/13/2025
360 The Restaurant at the CN Tower,Everything was great except for my plate of food. I ordered the half lobster and I literally was only able to only get one piece of good lobster meat off of it.,4,10/12/2025
360 The Restaurant at the CN Tower,Amazing view of city while having food. Amazing food. Highly recommended,4,10/12/2025
360 The Restaurant at the CN Tower,"It is all about the view, absolutely fabulous way to take it in. Would definitely go back to restaurant if I wanted to see the view from the CN Tower again. Much better value than observation level tickets.",5,10/11/2025
360 The Restaurant at the CN Tower,"Came here with family and some extended family visiting Canada for the first time. We decided to get the nachos and it was expensive but it did come very fast!<br><br>When we got the nachos, we saw that there wasn’t enough cheese on it, so when we complained about it, they came took it away and got us a brand new one with more cheese, no questions asked!<br><br>Very attentive and helpful staff members that are understanding. Their brownies were also the best I ever had and the cookies weren’t bad either! I do recommend eating here and enjoying the beautiful views from the CN tower of Downtown Toronto, Lake Ontario and the surrounding GTA. It’s amazing to see the view from so high with good food especially if you’re new to the area or visiting!",5,10/10/2025
360 The Restaurant at the CN Tower,"Amazing views and delicious food! Such a stark contrast between the experience in the restaurant versus the main observation deck below. We enjoyed admiring the view in the comfort of our dining table. You do notice the rotation but it is not motion sickness inducing at all. It took about 1 hr for a full rotation. 360 guests have their own dedicated elevator so we didn't have to queue at all. Our server Keith was amazing, and the food, even though somewhat overpriced, was delicious! Ordered the Alfredo pasta for our toddler, and for a simple kid's meal, it was absolutely delicious, the adults ended up eating most of it. Ended up spending almost $300 USD for 3 adults and 1 toddler, including tip. Overall, it was worth it. You must reserve online ahead of time- reserved ours about 2 months ahead.",5,10/07/2025
360 The Restaurant at the CN Tower,"The views are absolutely the reason to go. The location and overall experience are what make 360 special.<br><br>The service was good and there was no wait time to be seated.<br><br>That said, I’ll be honest — my first visit about a year ago (during the day) was much better. On this last visit, the food quality was a bit disappointing compared to before.<br><br>It’s definitely an expensive place, but you’re really paying for the views and the unique experience, not so much for a top-tier culinary experience. Still, it’s worth visiting at least once — especially if you’ve never been.",5,10/07/2025
360 The Restaurant at the CN Tower,I Had food and drinks at youth center after burial and funeral active.,4,10/07/2025
360 The Restaurant at the CN Tower,"The view is nice, but the service completely ruined the experience. Our waitress, Juli, was rude and disrespectful from the start. Her unwelcoming attitude made us feel uncomfortable and spoiled the visit.",1,10/07/2025
360 The Restaurant at the CN Tower,"Oysters had dirt and shells in them. We ordered a half dozen and 5 of them were still dirty and gritty. Lamb chops would’ve been better with a different seasoning, maybe a mint sauce. Wasn’t a personal fan. The issue was the scallops - served ice cold when we were told it was a hot dish. We were then told to order something else if we didn’t like the scallops cooked that way. Terrible experience considering the price and venue - would definitely not ever recommend. You’d think torontos biggest attraction could have at least decent food. Overall 3/10",1,10/06/2025
360 The Restaurant at the CN Tower,It was an experience of a lifetime. We were made to feel special from the moment we walked through the door. The service was exceptional and the food was exquisite.,5,10/06/2025
360 The Restaurant at the CN Tower,"I am saying this with genuine concern, the food I got today was actually great but our server, MIKE was unbelievably rude! It’s too bad because I quite enjoyed the muscles and the prime rib that I got.  Pricey but I get it, you are here for the experience. This was my first time dining at 360 restaurant. The pre-fixe menu had reasonable options in my opinion.<br><br>To break it down, Mike asked us if we wanted still water or sparkling. Everyone was quite busy chatting as we were a big table of 10. Then came the glass bottles of water, which cost our table an additional $40+.<br><br>Then other servers who were helping Mike suddenly offered us tap water for refills after the first course was complete. We were the only table who were upsold bottled water in our section of the dining hall.<br><br>Mike was consistently aggressive the entire evening. From asking from the beginning if we’re paying only with one bill. I have never been asked this question before at any other sit-down restaurant prior to a meal. He barely attended our table, his colleagues did. Most of us got steaks and 3 of us didn’t get steak knives. We had to ask for it. He was also standing there supervising and not once did he offer us water refills. His two teammates I guess were tasked to help him.<br><br>When I was finally decided on what alcoholic drink to get; Mike was nowhere to be found so I had to ask another server for the beer. Mind you I waited for about 10 minutes or so and good thing his colleague came by with more water.<br><br>He also seemed pretty upset that we did separate bills as well. For a group of ten individuals. Was he really expecting anybody from one big table to foot a bill of $1,100+? It was quite obvious that this was not a family dinner. And we were a group of friends. My bill alone was $140+ with automatic gratuity included in the bill. That tip hopefully was shared with his colleagues as I would not have given such a big tip for a disappointing experience with our server, Mike.<br><br>I also need to highlight that for some reason, my apple pay didn’t go through twice using the debit machine. I am not sure why either. But his response to this was “DECLINED SIR” both times insinuating that I was at fault that their machine somehow didn’t accept my apple pay tap. I used my actual debit card instead and then that worked for some reason.<br><br>I even witnessed this guy point to my friend on my left giving him a signal that it’s his turn to pay. You can see it from his facial expression as well on how he was impatient with my friend who was distracted talking to another friend on his left side.<br><br>Please remind your servers that people know 360 is not a cheap place to dine at. He made it seem that we were there as teenagers who was not ready to act like adults. I would never get this type of obnoxious service outside.<br><br>I don’t know what our server was going through outside of work, but that was the most uncomfortable I’ve been at a restaurant because of this server’s awful attitude towards guests.",1,10/06/2025
360 The Restaurant at the CN Tower,Awesome experience! Made my birthday special!,5,10/05/2025
360 The Restaurant at the CN Tower,"The view is amazing, service is also fantastic. The food was middy but overall worth it",4,10/03/2025
360 The Restaurant at the CN Tower,"Great venue, polished and friendly service from Bobby (36 yrs he has worked there!), great martini and wonderful menu.",5,10/02/2025
360 The Restaurant at the CN Tower,"Only the view and the food is good.  Service is lacking.  We were charged 20% gratuities on our bill which is $144 extra, for limited service.<br><br>Waiter just took the order and delivered the food.  Service cant even compare to local restaurants like Joey, Milestone, Moxies......",3,10/01/2025
360 The Restaurant at the CN Tower,The view is of course unbeatable! The food is understandably very overpriced and I wouldn't say the quality is that great. The service is also not the best... but I would still go at least once to experience dining above the entire city,3,09/30/2025
