restaurant,review,rating,date
360 The Restaurant at the CN Tower,Service was excellent. Wait Staff was very attentive by always filling our water and wine glass.  Waiter offered a carafe to decant the wine. Checking to make sure we had everything we needed. Very friendly. Ambiance is on the sull side and could be improved. Burger should be offered on the kids menu.,5,12/29/2025
360 The Restaurant at the CN Tower,"Truffle tries cost $20 comes in a tiny plate with no parm. The server tall, no hair fought me to tell me how the truffle was in aioli. Excuse me? For $20 shaved parm on truffle fries is a must. Fries were sub par.  Lamb was okay, our bill was over $3k and to not be served a bit more than what was on the menu was very off putting. That server needs to simmer down a bit",3,12/28/2025
360 The Restaurant at the CN Tower,"We recently dined at the 360 Restaurant at the CN Tower and left feeling conflicted. While the food, wine, and cocktails were genuinely delicious, the overall experience did not align with what is advertised—or priced—as fine dining.<br>From the start, the service fell short of fine dining standards. Our server was very difficult to understand and shared personal stories (including about receiving a police ticket) and asked personal questions that felt inappropriate in a high-end dining environment. This points to a need for more thorough training around professionalism and guest interaction.<br>There were also several operational issues that detracted from the experience. We were told the restaurant had run out of candles and did not have enough for each table. The latte machine was broken, yet a regular coffee with a small amount of milk was presented as a latte, which felt misleading.<br>Additionally, the atmosphere did not reflect a fine dining setting. There was a noticeable mismatch in customer attire—one table dressed in hoodies and sweatpants, another in blazers and dresses—which created an inconsistent and confusing experience. If 360 positions itself as fine dining, clearer expectations around dress code and ambiance should be set and upheld.<br>Unfortunately, the experience felt no different in service quality than dining at a casual chain restaurant like Kelsey’s or East Side Mario’s—aside from the exceptional view. Based on our experience, the quality of service and overall expectations at 360 appear to have declined over the years, and the current price point no longer feels justified.<br>In summary, while the culinary side remains strong, significant improvements are needed in service training, atmosphere, and expectation-setting to truly deliver a fine dining experience that matches the cost and reputation of this iconic venue.",3,12/28/2025
360 The Restaurant at the CN Tower,"We got terrible experience from servers in the restaurant. Service was lower than we expected for the price they charge. We paid 900$ for 7 people. They mixed up one of our orders, spilled the water on the table, brought us moulded sweet potatoes. Food was mediocre.<br>And the most unacceptable thing was that our server pre-included 20% tips without even asking us. As we didn’t have experience before, we thought that it was restaurant’s policy. But after reading reviews here I understand that the waiter just fooled us.<br>I would not recommend 360 to anyone!",1,12/28/2025
360 The Restaurant at the CN Tower,"We still here today, and the food experience was very bad. The food or whithout flavor or with bad flavor. The employers just want go home, they dont care about your experience.",3,12/25/2025
360 The Restaurant at the CN Tower,Nice view the menu needs a change been here few occasions.,5,12/24/2025
360 The Restaurant at the CN Tower,"My husband took me here for our anniversary. Apart from the view and the nice restaurant, there wasn’t much going on. The food we ordered was terrible, my husband got the prime rib and I got the salmon which was paired with tomato sauce. Both were incredibly bland, we ended up leaving more the 50% of our food. The appetizer with shishito peppers and hummus was nice. But tomato sauce should not be paired with salmon and a little seasoning wouldn’t hurt. My husband said there was a lot of fat on his steak and it tasted bland and from the looks of it, it was almost pale and absolutely not juicy or succulent. This restauraunt was extremely over hyped. Our server rushed us and didn’t really recommend anything. Will not be returning.",1,12/24/2025
360 The Restaurant at the CN Tower,"Very nice experience, people are super friendly and they welcome and greet you specially when you have special occasions . Won’t be my last visit.",5,12/24/2025
360 The Restaurant at the CN Tower,"Babu and the team in section 6 were brilliant! We visited on Dec 14 for dinner and booked an early seating so we could see the sun set. The weather played nice and the sky was clear and we had a stunning view. Inside the restaurant, Babu lead his team through a great service and was very patient with a group of chatty girlfriends hanging out. He was also great with accommodating dietary restrictions. The evening was lovely and everyone agrees it's definitely going to be on the list for when friends and family visit in the future.",5,12/23/2025
360 The Restaurant at the CN Tower,"We came to celebrate our anniversary and were disappointed that there was no acknowledgment, especially after seeing other guests mention special anniversary treats in reviews.<br>During payment, we had technical issues with Apple Pay and did not have a physical card, so we split the bill between cash and card. Despite our intention to tip, the server made jokes about it, which felt unprofessional and made the experience uncomfortable.",2,12/22/2025
360 The Restaurant at the CN Tower,"Absolutely amazing experience friendly service and food was good and The view was phenomenal , fantastic and very beautiful Our server was so friendly ❤️♥️♥️Thank you 🙏",5,12/22/2025
360 The Restaurant at the CN Tower,"Had dinner at the 360 with my wife. My wife chose the indigenous menu and I chose the $75 pre fix. Quite honestly for what you pay the food is just not very good. On a positive note, service was great. The keg would have been a much better choice",3,12/22/2025
360 The Restaurant at the CN Tower,"I was on a layover enroute to UAE and recently had a dinner here with a friend who I haven’t seen in a long time.<br>The service started out strong (friendly, took photos) and then gradually the experience crumbled.<br>The server at first was pleasant informative, however she coughed the entire time and took away from the experience. My thought is, if you’re sick and coughing don’t come to work and risk getting others sick especially in the food service industry.<br><br>The food itself was ok, I asked for an additional sauce for my prime rib and the presenting server was telling me that I had sauce right in front me. I said I know this, I just wanted another one. He seemed annoyed that I asked for more sauce. When you spend an additional $45 for an upsell I think you can have more sauce.<br>My biggest pet peeve of the evening was we felt rushed. As we were eating bread they tried to take it away and I said we were still eating.<br><br>When we were wanting to order desert our server was no where to be found.<br><br>When I was mid sentence showing my friend a video on my phone, the server interrupted us to ask us if we wanted separate bills. I explained to her we were busy at the moment, and she seemed annoyed she had to wait for our response. It was apparent her shift was nearing an end and we were the last folks in her section to leave.<br><br>No server had a problem asking me for a 25% tip on their mediocre, get the heck out of here service for a $165.00 meal.<br><br>Lastly this place was cold , they can easily turn up the heat, but they choose to save on costs and keep the place cold.<br><br>With transportation costs from my airport hotel, and meal this cost $400, the restaurant service diminished the high level city light experience.",3,12/22/2025
360 The Restaurant at the CN Tower,The food are okay. You're pretty much paying for the experience.,3,12/21/2025
360 The Restaurant at the CN Tower,"My meal was amazing. They accommodated my allergies so well. Only thing I would note is our servers cocktail knowledge. I asked if they could do their signature sour with aquafaba, and the server had no clue what that was. Fair enough, so i clarified and asked for the vegan alternative to egg whites- once again, did not know. A little odd but otherwise a lovely evening!",4,12/21/2025
360 The Restaurant at the CN Tower,We loved it—great food and a stunning 360° view of Toronto 💕,5,12/20/2025
360 The Restaurant at the CN Tower,Food took a while but we'll worth it our wait staff James was absolutely amazing 💯,5,12/20/2025
360 The Restaurant at the CN Tower,The rib eye was below average.,3,12/19/2025
360 The Restaurant at the CN Tower,"Food and service could be better, but overall atmosphere is great",5,12/19/2025
360 The Restaurant at the CN Tower,The food and service was excellent.,5,12/19/2025
360 The Restaurant at the CN Tower,"Amazing experience at 360 Restaurant! Great food, excellent service, and breathtaking city views.Perfect place for a special occasion<br>Truly memorable!!!",5,12/18/2025
360 The Restaurant at the CN Tower,Our server was the best. A decent humanitarian who understand people and excellent customer service...we celebrated our dear friend 46th birthday. A great vibe and memory,5,12/16/2025
360 The Restaurant at the CN Tower,"Stunning views on Toronto, enriching experience, perfect for a romantic event, gastronomic food, they try, not as a top class french restaurant but not bad for North Amercia, Beef is at +40$.",5,12/16/2025
360 The Restaurant at the CN Tower,Good overall.<br>Food was fine.<br>Waiter was nice.<br>View is amazing.<br>Recommend once but not something I would do twice.,4,12/16/2025
360 The Restaurant at the CN Tower,The Seafood Tower is amazing and services are great. Also fun to go downstairs to the observation levels to take pictures and walk on the glass floors.,5,12/16/2025
360 The Restaurant at the CN Tower,"This was an amazing experience to top off an incredible, if short, trip to Toronto. The staff were so friendly and helpful, the food was amazing, and obviously the views were breathtaking. Thank you so much.",5,12/15/2025
360 The Restaurant at the CN Tower,Great food and service. Also beautiful views of the city,5,12/14/2025
360 The Restaurant at the CN Tower,"A memorable night at Toronto’s 360 Revolving Restaurant with my beautiful family. Good food, stunning views, and the best company - a perfect combination for a truly unforgettable experience.",5,12/12/2025
360 The Restaurant at the CN Tower,"I think the only nice thing about the restaurant is the view because the food was terrible. Although they changed the appetizer I ordered because I couldn't eat it, the other one wasn't any better, and the main courses weren't good at all. The view was beautiful and romantic.",1,12/09/2025
360 The Restaurant at the CN Tower,The food excellent and amazing view love it will be back,5,12/08/2025
360 The Restaurant at the CN Tower,We had a lovely evening. Great service and the view was incredible.  We will definitely be back soon.,5,12/07/2025
360 The Restaurant at the CN Tower,"Excellent food, service and atmosphere.",5,12/07/2025
360 The Restaurant at the CN Tower,"The view and ambience at 360 Restaurant were amazing, but the food was extremely disappointing. From starter to dessert everything was bland, poorly presented, and far below expectations. The overall experience of being at the top of the CN Tower was the only highlight.",2,12/07/2025
360 The Restaurant at the CN Tower,"Book ahead on their website to guarantee the table. They were all booked when we went (people without tickets were turned away). It is great to go closer to sunset time, as the colors in the sky make it so much more beautiful. I loved the cocktails. When you book your ticket to the restaurant (min 75 spent per person), you also get access to observatory deck. I went to just observatory deck a while back, and I recommend to get restaurant experience, it is much more elevated and enjoyable. Observatory deck is full of people. Restaurant makes you enjoy your time. It is great it rotates, so you can always enjoy the change of view. ❤️",5,12/06/2025
360 The Restaurant at the CN Tower,Must visit restaurant. You get a great dinner with the set course menu and it allows you to enjoy the view while the crowd is gone.,5,12/04/2025
360 The Restaurant at the CN Tower,Little disappointed in the whole aspect...it ended to be very expensive and the food was mediocre. The deserts were good. Bobby served our food and he was exceptional....,3,12/03/2025
360 The Restaurant at the CN Tower,Food much better than expected (though pricey of course). Loved the white chocolate mousse cake. The view is unbeatable. Would probably do again for a special occasion.,5,12/03/2025
360 The Restaurant at the CN Tower,The food and was service was great!,4,12/02/2025
360 The Restaurant at the CN Tower,Asked for a medium rare steak and got this?,1,12/02/2025
360 The Restaurant at the CN Tower,"Exceptional Dinner Experience – 10/10!<br>What an absolutely fantastic dining experience! From the moment we arrived, everything was on another level. The food and drinks were truly amazing — every dish was bursting with flavor, beautifully presented, and cooked to perfection. Definitely a solid 10/10!<br>The service deserves its own praise. The staff were incredibly friendly, attentive, and unbelievably fast. They catered to everyone at our table with genuine care and made sure we had everything we needed. They even helped us take photos, which was such a thoughtful and appreciated touch.<br>The whole evening felt effortless and enjoyable thanks to the wonderful team and delicious food. One of the best dining experiences I’ve had in a long time. Highly recommend!",5,12/01/2025
360 The Restaurant at the CN Tower,"Horrible experience!! The waiter - his name is JEWEL, shouldn’t be working in customer service. He was very rude, bizarre and straight up acting on edge.<br>He body shamed my friend and I. Telling my friend about diet when she tried to order. Then went ahead and talked about how his wife was now on diet, how his life had already ended because he has kids. Just bizarre!!<br>I got the manager to come over to the table and told him what had just happened with the waiter. He left and later came back offering us a desert menu!!!😂😂😂ooh the irony in that! Offering us junk after body shaming!!<br>The food was so AWFUL!! It was like someone had sucked all the spices and flavours from it then put it back on the plate🤢.<br>Won’t be going back to this restaurant that’s for sure!!",1,11/30/2025
360 The Restaurant at the CN Tower,My husband proposed to me here. It was magical! Love the ambience of this place and my waiter was so helpful with explaining the menu items.,5,11/30/2025
360 The Restaurant at the CN Tower,"Came here for my birthday expecting a good experience and evening , was extremely let down and disappointed this place would be nothing without the view . server was fine , pretty invisible after the food arrived but i ordered the Seafood tower or something like that, that was one of the biggest disappointments and mistakes of that night including picking this place to eat . once i realized that i ordered another meal to make up for it because i didnt want the night to be a waste especially on my birthday, the steak i ordered took forever to come out and had to be sent back because it was extremely undercooked and when it came back it was still undercooked which made me leave it and ask for the bill and leave . $450 usd, wasted.",1,11/30/2025
360 The Restaurant at the CN Tower,"Our $202 gratuity was automatically added to our bill which is fine , but then we were prompted to add another tip on the debit machine and verbally by the server. I was not about to tip more than the $202 already added to my bill. I had to manually enter a $0 on the debit machine and then was given a disapproving look by the server.  I was made to feel very awkward even after spending $1375 on dinner including the $202 gratuity.  Very uncomfortable ending to a nice dinner. Service wasn’t great either for such a nice place. I mentioned this all on their survey sent out the next day and received no response.",3,11/28/2025
360 The Restaurant at the CN Tower,"⭐️⭐️⭐️⭐️⭐️<br>Had the most beautiful anniversary dinner here — warm service, stunning dishes, and an ambience that made the night feel special. 🥂✨<br><br>The pacing was perfect, the staff were genuinely thoughtful, and the complimentary access to both the main and lower observation levels was such a bonus. The views made everything unforgettable. 🍽️🌙",5,11/28/2025
360 The Restaurant at the CN Tower,"We were here for my birthday. I expected very better and beautiful interior design, but it was not what I expected. Our host was good but food was disappointing. We ordered beef ribs and salmon for main course. The salmon was ok but it was cold. But the texture of the meat was awful.<br>In comparing the other 360 restaurants in other countries, it was really bad.",2,11/27/2025
360 The Restaurant at the CN Tower,"We went yesterday & unfortunately the weather was bad. We decided to stay & eat. Thankfully the food was very good, so much so we decided to return the following day (today). Weather was so much better which meant incredible views whilst dining. We both loved the food & the service from Bobby was top class. Amazing server & a credit to 360. Would truly recommend this to anyone thinking of going, plus you get free admission to the main observation deck after dining. Thank you for a wonderful experience!",5,11/27/2025
360 The Restaurant at the CN Tower,"Terrible experience at the 360 Restaurant. Our server, Ricky, was very rude, and the food was disappointing and not worth the price. Only the view was nice. Would not go back.",1,11/25/2025
360 The Restaurant at the CN Tower,"Went there to celebrate my birthday. As we exited purple elevator, 2 girls instructed us to stand for photo, so we did. Pretty sure you can refuse if you don’t want to but since it is our first time & none of in a review described this, we did what we asked. Later we found out the picture they took is for us to purchase (if we interested in) for $45+tax cash as the girl came to our table show us the picture & ask if we’d like to purchase it. Anyway, restaurant was busy considering it’s Sunday night, however, my daughter has reserve table for 3 so they sit us by the window which is amazing! The place is rotating 360 degree in 72 minutes as we were told. We were lucky to have a clear night. The foods overall were good. I ordered<br>red wine sangria as the other reviewer suggested. Love it & recommended. I picked 2 course with mussels as my appetizer & chicken for my main. The mussels was alright & in big portion for me. I think I got 1/4 chicken leg with bone removed from the thigh (not sure). It was delicious however the veggies that come with it not so much. My daughter picked the same 2 course meal with shishito peppers. She said it’s delicious & not too spicy. Salmon for her main tastes great. My husband on the other hand ordered ala carte caesar salad. He loves the dressing. King Cole duck duo for his main. He’s not too keen on veggies either. It’s dry.<br>Overall we enjoyed our evening in the city of Toronto. Amazing night out with lots of picture.",5,11/24/2025
360 The Restaurant at the CN Tower,Excellent experience with a rotating floor restaurant. Food was a little on expensive side but worth it because it includes the access to the attraction. Pick a reservation just before sunset to maximize the views.,5,11/22/2025
360 The Restaurant at the CN Tower,"We went into this lunch with very low expectations — we honestly assumed people come here just for the view and the food would be an afterthought. But WOW… we were so wrong, in the best way possible.<br>Grilled Octopus<br>This dish alone changed the tone of the entire lunch. Perfectly cooked — tender, not chewy — with a beautiful char. The greens and sauce complemented it so well, every bite worked. Easily one of the best octopus plates we've had lately.<br><br>Duck Breast + Confit<br>Medium-rare plus, exactly how duck should be. Rich flavor, juicy inside, and that crispy confit skin… perfection. If you’re a duck lover, this one will make you happy.<br>Lamb Shank<br>Fall-off-the-bone tender, super flavorful, and beautifully plated. The only note from us — we wished the polenta puree under it was a bit thicker to balance the sauce. Still delicious overall.<br><br>White Mousse Dessert<br>This one surprised us — light, creamy, refreshing and perfectly sweet. It was the perfect finish to an unexpectedly great meal.<br>Final Verdict<br>We came for the view… and left talking about the food. 360 is absolutely worth the experience — the rotating skyline, the energy, and yes, the dishes are genuinely good. If you’re in Toronto, put this on your list.<br><br>We’ll definitely be back.",5,11/21/2025
360 The Restaurant at the CN Tower,I absolutely loved the view and the food. The service was excellent — the servers were attentive at all times and very friendly. Everything made the experience truly enjoyable.,5,11/20/2025
360 The Restaurant at the CN Tower,Food was not good. Was expecting more of a gourmet food but it was more like diner type of food quality. I got salmon and mussels but the sauce the smell was over powering like a bad sea food smell. For the price we paying you should do a better food menu,3,11/19/2025
360 The Restaurant at the CN Tower,"You go there only for the view. Really touristic attraction. Food was cold and not that tasty. Service was good though. Sadly, the experience doesn't worth the price. Wine list need to be updated!",3,11/17/2025
360 The Restaurant at the CN Tower,"While the atmosphere is quite frankly amazing, the food doesn’t come close to matching it. Although, the servers (not service due to long wait times) do make up for it a little.<br><br>TLDR; Food comped, steak + replacement overcooked and dry, servers + atmosphere good, would not come again.<br><br>From the start, if you have a reservation, expect to still wait in line for 20-30 min, regardless of the time of your reservation.<br><br>From being given the menus, it took a little over an hour to be given 2 steaks with fries. The steaks came overcooked, there was not a slither of pink inside of them. Mind you, we usually order medium but decided to try medium well since we thought this would be a place that could cook them properly. However, the server agreed that the steaks were past medium-well, and quite frankly they kind of tasted like they were past well done as well, but I’m not an expert in food by any means.<br><br>The steaks we received were tasteless, and the sauces that came with them didn’t help. While the fries were good, they weren’t much different than any less expensive place and the truffle sauce was a little gimmicky. The cocktails and drinks were quite good though.<br><br>The servers, although a bit blatantly putting on an act, are very polite and reassuring. Upon checking up on us and seeing our steak, it was taken back immediately. We were also checked up on multiple times while waiting. Ultimately, our steaks and dessert were made free. However, the second set of steaks somehow managed to make one of the steaks even tougher, albeit making the other one softer (although there’s still no pink). The server didn’t even have to ask when she looked at them and apologized extensively while telling us that she’ll talk to a manager because this experience was ridiculous.<br><br>It’s worth noting that although obvious, it’s probably not the best idea for the staff to loudly say “where did that table go”… “they left”… “why’d they leave”… when people are sitting and waiting for food… kind of makes you want to follow their lead.<br><br>While this may be a one off, I read comments with similar grievances before coming, so at this point I’m discouraged from coming back… especially for an anniversary.",3,11/17/2025
360 The Restaurant at the CN Tower,It was a lovely evening. The food is excellent and we felt well cared for. The views of the city lights were very entertaining.,5,11/16/2025
360 The Restaurant at the CN Tower,"We were 30 min late due to bad traffic on the Gardiner coming into town. Staff was really great at accommodating our late arrival. Food was perfect, our server was pleasant. Thank you guys for a great night!",5,11/16/2025
